{
  "id": "sheet_0SePPJ4KDQ5zgxnYQ3ZtDc",
  "kind": "template",
  "platform": "web",
  "page_types": [
    "home",
    "dashboard",
    "other"
  ],
  "density": "medium",
  "personality": [
    "clean",
    "professional"
  ],
  "best_for": [
    "HeroUI Kit V3",
    "ds kit from catalog sheet"
  ],
  "strengths": [
    "Sheet-categorized community file for offline/catalog selection"
  ],
  "weaknesses": [
    "No extracted structure/ in this profile — do not treat as a compiled Figma layout"
  ],
  "tags": [
    "ds",
    "heroui",
    "kit"
  ],
  "description": "Sheet catalog row: HeroUI Kit V3. File key 0SePPJ4KDQ5zgxnYQ3ZtDc. Generate may select this key by bucket; live Figma is ingest-only.",
  "figma_file_key": "0SePPJ4KDQ5zgxnYQ3ZtDc",
  "license": "community",
  "source": "sheet",
  "version": "1",
  "industry": []
}
