{
  "id": "sheet_L6fzDJmTnke43vjJWLSkH0",
  "kind": "template",
  "platform": "web",
  "page_types": [
    "home",
    "dashboard",
    "other"
  ],
  "density": "medium",
  "personality": [
    "clean",
    "professional"
  ],
  "best_for": [
    "Get UI (FREE)",
    "ds kit from catalog sheet"
  ],
  "strengths": [
    "Sheet-categorized community file for offline/catalog selection"
  ],
  "weaknesses": [
    "No extracted structure/ in this profile — do not treat as a compiled Figma layout"
  ],
  "tags": [
    "ds",
    "get",
    "free"
  ],
  "description": "Sheet catalog row: Get UI (FREE). File key L6fzDJmTnke43vjJWLSkH0. Generate may select this key by bucket; live Figma is ingest-only.",
  "figma_file_key": "L6fzDJmTnke43vjJWLSkH0",
  "license": "community",
  "source": "sheet",
  "version": "1",
  "industry": []
}
