{
  "id": "sheet_yJ7VsV0epdP0RYDGL8b48L",
  "kind": "template",
  "platform": "mobile",
  "page_types": [
    "home",
    "list",
    "detail"
  ],
  "density": "medium",
  "personality": [
    "clean",
    "professional"
  ],
  "best_for": [
    "Mobile freebie screens",
    "mobile kit from catalog sheet"
  ],
  "strengths": [
    "Sheet-categorized community file for offline/catalog selection"
  ],
  "weaknesses": [
    "No extracted structure/ in this profile — do not treat as a compiled Figma layout"
  ],
  "tags": [
    "mobile",
    "mobile",
    "freebie",
    "screens"
  ],
  "description": "Sheet catalog row: Mobile freebie screens. File key yJ7VsV0epdP0RYDGL8b48L. Generate may select this key by bucket; live Figma is ingest-only.",
  "figma_file_key": "yJ7VsV0epdP0RYDGL8b48L",
  "license": "community",
  "source": "sheet",
  "version": "1",
  "industry": []
}
