{
  "id": "sheet_tqmXjyHAuoM2byJMreptYS",
  "kind": "template",
  "platform": "web",
  "page_types": [
    "dashboard"
  ],
  "density": "medium",
  "personality": [
    "clean",
    "professional"
  ],
  "best_for": [
    "Web admin",
    "dashboard kit from catalog sheet"
  ],
  "strengths": [
    "Sheet-categorized community file for offline/catalog selection"
  ],
  "weaknesses": [
    "No extracted structure/ in this profile — do not treat as a compiled Figma layout"
  ],
  "tags": [
    "dashboard",
    "web",
    "admin"
  ],
  "description": "Sheet catalog row: Web admin. File key tqmXjyHAuoM2byJMreptYS. Generate may select this key by bucket; live Figma is ingest-only.",
  "figma_file_key": "tqmXjyHAuoM2byJMreptYS",
  "license": "community",
  "source": "sheet",
  "version": "1",
  "industry": []
}
