{
  "id": "sheet_zbJbnMYm07Q5lGzDYw8tbx",
  "kind": "template",
  "platform": "web",
  "page_types": [
    "home",
    "dashboard",
    "other"
  ],
  "density": "medium",
  "personality": [
    "clean",
    "professional"
  ],
  "best_for": [
    "Shadcn UI DS – Free",
    "ds kit from catalog sheet"
  ],
  "strengths": [
    "Sheet-categorized community file for offline/catalog selection"
  ],
  "weaknesses": [
    "No extracted structure/ in this profile — do not treat as a compiled Figma layout"
  ],
  "tags": [
    "ds",
    "shadcn",
    "free"
  ],
  "description": "Sheet catalog row: Shadcn UI DS – Free. File key zbJbnMYm07Q5lGzDYw8tbx. Generate may select this key by bucket; live Figma is ingest-only.",
  "figma_file_key": "zbJbnMYm07Q5lGzDYw8tbx",
  "license": "community",
  "source": "sheet",
  "version": "1",
  "industry": []
}
