{
  "id": "sheet_k6MvIYJvZRdWOXIzwRjiU6",
  "kind": "template",
  "platform": "mobile",
  "page_types": [
    "home",
    "list",
    "detail"
  ],
  "density": "medium",
  "personality": [
    "clean",
    "professional"
  ],
  "best_for": [
    "iOS 16 UI Kit (components + demos)",
    "mobile kit from catalog sheet"
  ],
  "strengths": [
    "Sheet-categorized community file for offline/catalog selection"
  ],
  "weaknesses": [
    "No extracted structure/ in this profile — do not treat as a compiled Figma layout"
  ],
  "tags": [
    "mobile",
    "ios",
    "kit",
    "components",
    "demos"
  ],
  "description": "Sheet catalog row: iOS 16 UI Kit (components + demos). File key k6MvIYJvZRdWOXIzwRjiU6. Generate may select this key by bucket; live Figma is ingest-only.",
  "figma_file_key": "k6MvIYJvZRdWOXIzwRjiU6",
  "license": "community",
  "source": "sheet",
  "version": "1",
  "industry": []
}
