{
  "id": "sheet_3BntoT09ryHp8jtFO7nwsM",
  "kind": "template",
  "platform": "web",
  "page_types": [
    "home",
    "dashboard",
    "other"
  ],
  "density": "medium",
  "personality": [
    "clean",
    "professional"
  ],
  "best_for": [
    "Buttons Mega Builder",
    "ds kit from catalog sheet"
  ],
  "strengths": [
    "Sheet-categorized community file for offline/catalog selection"
  ],
  "weaknesses": [
    "No extracted structure/ in this profile — do not treat as a compiled Figma layout"
  ],
  "tags": [
    "ds",
    "buttons",
    "mega",
    "builder"
  ],
  "description": "Sheet catalog row: Buttons Mega Builder. File key 3BntoT09ryHp8jtFO7nwsM. Generate may select this key by bucket; live Figma is ingest-only.",
  "figma_file_key": "3BntoT09ryHp8jtFO7nwsM",
  "license": "community",
  "source": "sheet",
  "version": "1",
  "industry": []
}
