{
  "id": "sheet_REMe6TT3iWXX5CUx4truQZ",
  "kind": "template",
  "platform": "web",
  "page_types": [
    "dashboard"
  ],
  "density": "medium",
  "personality": [
    "clean",
    "professional"
  ],
  "best_for": [
    "Smart Charts",
    "dashboard kit from catalog sheet"
  ],
  "strengths": [
    "Sheet-categorized community file for offline/catalog selection"
  ],
  "weaknesses": [
    "No extracted structure/ in this profile — do not treat as a compiled Figma layout"
  ],
  "tags": [
    "dashboard",
    "smart",
    "charts"
  ],
  "description": "Sheet catalog row: Smart Charts. File key REMe6TT3iWXX5CUx4truQZ. Generate may select this key by bucket; live Figma is ingest-only.",
  "figma_file_key": "REMe6TT3iWXX5CUx4truQZ",
  "license": "community",
  "source": "sheet",
  "version": "1",
  "industry": []
}
