{
  "id": "sheet_N0Uc9SUEQUSUy4wNMsGH1C",
  "kind": "template",
  "platform": "landing",
  "page_types": [
    "landing"
  ],
  "density": "medium",
  "personality": [
    "clean",
    "professional"
  ],
  "best_for": [
    "B2Base – B2B SaaS / startups (Free)",
    "landing kit from catalog sheet"
  ],
  "strengths": [
    "Sheet-categorized community file for offline/catalog selection"
  ],
  "weaknesses": [
    "No extracted structure/ in this profile — do not treat as a compiled Figma layout"
  ],
  "tags": [
    "landing",
    "b2base",
    "b2b",
    "saas",
    "startups",
    "free"
  ],
  "description": "Sheet catalog row: B2Base – B2B SaaS / startups (Free). File key N0Uc9SUEQUSUy4wNMsGH1C. Generate may select this key by bucket; live Figma is ingest-only.",
  "figma_file_key": "N0Uc9SUEQUSUy4wNMsGH1C",
  "license": "community",
  "source": "sheet",
  "version": "1",
  "industry": []
}
